[
  {
    "id": "Q001",
    "title": "第359話の1014号室で起きた初期殺害の実行者",
    "category": "事件",
    "known": "第359話でウッディーと王室警備兵4名の死亡が確認されている。",
    "unknown": "誰が襲撃し、どの能力を使ったか。",
    "related_event_ids": ["E359-002", "E359-003"],
    "status": "open",
    "last_checked_chapter": 420
  },
  {
    "id": "Q002",
    "title": "サイレントマジョリティーの術者",
    "category": "事件",
    "known": "念講習会でロベリーに座敷人形が憑き、バリゲンとミュハンが殺害された。",
    "unknown": "能力を使った人物と、当初の標的の全容。",
    "related_event_ids": ["E370-003", "E376-002"],
    "status": "open",
    "last_checked_chapter": 420
  },
  {
    "id": "Q003",
    "title": "船外への脱出を阻む無数の手",
    "category": "儀式・制度",
    "known": "救命艇で船外へ出たカチョウとフウゲツは無数の手に襲われ、フウゲツは船内へ戻った。",
    "unknown": "無数の手の正体と、脱出を阻む条件。",
    "related_event_ids": ["E383-005"],
    "status": "open",
    "last_checked_chapter": 420
  },
  {
    "id": "Q004",
    "title": "チョウライの守護霊獣が生むコインの効果",
    "category": "念・能力",
    "known": "コインが生まれ、刻まれた数字が時間の経過とともに変化する。",
    "unknown": "数字が変わる条件と、コインがもたらす具体的な効果。",
    "related_event_ids": ["E389-009", "E404-001"],
    "status": "open",
    "last_checked_chapter": 420
  },
  {
    "id": "Q005",
    "title": "フウゲツの衰弱と邪霊の原因",
    "category": "念・能力",
    "known": "フウゲツの衰弱、周囲の邪霊、背中の痕が描かれている。",
    "unknown": "それぞれの原因と相互の関係。ルズールスの関与は未確定。",
    "related_event_ids": ["E400-006", "E402-005", "E402-006"],
    "status": "open",
    "last_checked_chapter": 420
  },
  {
    "id": "Q006",
    "title": "王子の中にいるとされるビヨンドの実子と呪い",
    "category": "王族・継承",
    "known": "ロンギはビヨンドの実子だと名乗り、王子の中にも実子がいると語った。",
    "unknown": "該当する王子の正体、呪いの対象と仕組み、ビヨンドの意図。",
    "related_event_ids": ["E401-002", "E401-004", "E415-001"],
    "status": "open",
    "last_checked_chapter": 420
  },
  {
    "id": "Q007",
    "title": "第14王子の資格・身元・所在",
    "category": "王族・継承",
    "known": "第411〜412話の記録では、継承資格と船内にいる王子の身元を巡る情報が示される。",
    "unknown": "本物の第14王子の所在と、替え玉とされる人物の身元。",
    "related_event_ids": ["E411-004", "E412-002", "E414-003"],
    "status": "open",
    "last_checked_chapter": 420
  },
  {
    "id": "Q008",
    "title": "ハルケンブルグとバルサミルコの人格の行方",
    "category": "王族・継承",
    "known": "ハルケンブルグの本来の肉体は心拍停止し、その後も人格移動を伴う行動が描かれる。",
    "unknown": "第413話の鳴動以降の両者の人格の所在と、継承戦上の扱い。",
    "related_event_ids": ["E404-005", "E411-001", "E413-002"],
    "status": "open",
    "last_checked_chapter": 420
  },
  {
    "id": "Q009",
    "title": "TSK-17の感染経緯と王子たちへの影響",
    "category": "事件",
    "known": "ベンジャミンの発症と特殊戒厳令の発動が記録され、ほかの王子の感染も議論されている。",
    "unknown": "感染経路、感染が疑われる王子の状態、継承戦への影響。",
    "related_event_ids": ["E413-003", "E416-001", "E417-003"],
    "status": "open",
    "last_checked_chapter": 420
  }
]
